{"schemaVersion":"1.0.0","id":"fixture-second-expiration","version":"1.0.0","lifecycle":"draft","name":"Loopback recovery fixture","description":"Loopback recovery fixture","target":{"surface":"web","product":"loopback-fixture","entryPoint":{"kind":"absoluteUrl","url":"http://127.0.0.1:58716/login"},"fingerprints":[{"kind":"requiredText","id":"login-text","text":"Login"}]},"contract":{"inputs":{},"requiredSecrets":["FIXTURE_USERNAME","FIXTURE_PASSWORD"],"outputs":{"recoveredValue":{"description":"Protected fixture output","shape":{"kind":"string","minLength":1}}},"businessOutcomes":[{"code":"PERMISSION_DENIED","result":"permissionDenied","description":"Fixture denial","detection":{"kind":"textPresent","text":"Permission denied","description":"Fixture permission denial"}}]},"policyRef":"fixture-policy","preconditions":[],"steps":[{"id":"open-login","description":"Open login","action":{"kind":"navigate","destination":{"kind":"relativeRoute","route":"/login"}},"risk":"read","timeoutMs":5000,"checkpoint":{"kind":"textPresent","text":"Login","description":"Login visible"},"recovery":{"kind":"none"}},{"id":"enter-username","description":"Enter username","action":{"kind":"enterText","target":{"description":"username field","candidates":[{"strategy":"attribute","name":"name","value":{"kind":"literal","value":"username"}}],"match":"exactlyOne"},"value":{"kind":"secret","name":"FIXTURE_USERNAME"},"clear":true},"risk":"reversibleWrite","timeoutMs":5000,"checkpoint":{"kind":"elementVisible","description":"Password visible","target":{"description":"password field","candidates":[{"strategy":"attribute","name":"name","value":{"kind":"literal","value":"password"}}],"match":"exactlyOne"}},"recovery":{"kind":"none"}},{"id":"enter-password","description":"Enter password","action":{"kind":"enterText","target":{"description":"password field","candidates":[{"strategy":"attribute","name":"name","value":{"kind":"literal","value":"password"}}],"match":"exactlyOne"},"value":{"kind":"secret","name":"FIXTURE_PASSWORD"},"clear":true},"risk":"reversibleWrite","timeoutMs":5000,"checkpoint":{"kind":"elementVisible","description":"Submit visible","target":{"description":"Submit","candidates":[{"strategy":"role","role":"button","name":{"kind":"literal","value":"Submit"}}],"match":"exactlyOne"}},"recovery":{"kind":"none"}},{"id":"submit-login","description":"Submit login","action":{"kind":"activate","target":{"description":"Submit","candidates":[{"strategy":"role","role":"button","name":{"kind":"literal","value":"Submit"}}],"match":"exactlyOne"}},"risk":"reversibleWrite","timeoutMs":5000,"checkpoint":{"kind":"urlMatches","description":"Landing page","pattern":"/landing"},"recovery":{"kind":"none"}},{"id":"open-protected","description":"Open protected page","action":{"kind":"navigate","destination":{"kind":"relativeRoute","route":"/protected"}},"risk":"read","timeoutMs":5000,"checkpoint":{"kind":"textPresent","text":"Protected","description":"Protected page visible"},"recovery":{"kind":"reauthenticate","maxAttempts":1,"sessionExpired":{"kind":"textPresent","text":"Login","description":"Login returned after expiration"},"steps":[{"id":"recovery-enter-username","description":"Recovery Enter username","action":{"kind":"enterText","target":{"description":"username field","candidates":[{"strategy":"attribute","name":"name","value":{"kind":"literal","value":"username"}}],"match":"exactlyOne"},"value":{"kind":"secret","name":"FIXTURE_USERNAME"},"clear":true},"timeoutMs":5000,"checkpoint":{"kind":"elementVisible","description":"Password visible","target":{"description":"password field","candidates":[{"strategy":"attribute","name":"name","value":{"kind":"literal","value":"password"}}],"match":"exactlyOne"}}},{"id":"recovery-enter-password","description":"Recovery Enter password","action":{"kind":"enterText","target":{"description":"password field","candidates":[{"strategy":"attribute","name":"name","value":{"kind":"literal","value":"password"}}],"match":"exactlyOne"},"value":{"kind":"secret","name":"FIXTURE_PASSWORD"},"clear":true},"timeoutMs":5000,"checkpoint":{"kind":"elementVisible","description":"Submit visible","target":{"description":"Submit","candidates":[{"strategy":"role","role":"button","name":{"kind":"literal","value":"Submit"}}],"match":"exactlyOne"}}},{"id":"recovery-submit-login","description":"Recovery Submit login","action":{"kind":"activate","target":{"description":"Submit","candidates":[{"strategy":"role","role":"button","name":{"kind":"literal","value":"Submit"}}],"match":"exactlyOne"}},"timeoutMs":5000,"checkpoint":{"kind":"urlMatches","description":"Recovery landing","pattern":"/landing"}}],"checkpoint":{"kind":"urlMatches","description":"Recovery authenticated","pattern":"/landing"}}},{"id":"extract-value","description":"Extract recovered value","action":{"kind":"extract","output":"recoveredValue","target":{"description":"Protected output","candidates":[{"strategy":"css","selector":"#value"}],"match":"exactlyOne"},"transform":{"kind":"trim"}},"risk":"read","timeoutMs":5000,"checkpoint":{"kind":"outputPresent","description":"Output present","output":"recoveredValue"},"recovery":{"kind":"none"}}],"success":{"kind":"outputPresent","description":"Recovered output present","output":"recoveredValue"},"metadata":{"createdAt":"2026-09-30T00:00:00Z","provenance":{"kind":"authoredFixture","reason":"Deterministic recovery browser test"}}}